{
  "schema_version": "awesome-capture.transcription-state/v1",
  "status": "complete",
  "job_id": "a98234ccb4ae276079124a2c2f9c3b952a5dfba4767c49ad5f7797c88b892488",
  "settings_sha256": "47b6e5166baea42b90342f009a84f1f6ef5508c5596a52b504bf070c51b2e3f4",
  "execution_guard_sha256": "ffffffffffffffffffffffffffffffffffffffffffffffffffffffffffffffff",
  "settings": {
    "contract_digest": "647ca3a9d65d2b11af4e6a4cbe65eabf7f40c778616de84f2ef07b5ce1359001",
    "algorithm": {
      "version": "awesome-capture.transcription-algorithm/v1",
      "sha256": "dddddddddddddddddddddddddddddddddddddddddddddddddddddddddddddddd"
    },
    "source_path": "/private/stage/source.mp4",
    "source_sha256": "aaaaaaaaaaaaaaaaaaaaaaaaaaaaaaaaaaaaaaaaaaaaaaaaaaaaaaaaaaaaaaaa",
    "source_bytes": 2048,
    "upstream_artifact_sha256": null,
    "engine": "sidecar-subtitle",
    "engine_identity": {
      "identity_sha256": "bbe16f576ef1bc3abb90978bd36cbd63113ecb6acd3b7df379e9bdddeb0fca08",
      "model": null,
      "executable": null,
      "adapter": {
        "kind": "file",
        "path": "/private/stage/source.srt",
        "sha256": "aaaaaaaaaaaaaaaaaaaaaaaaaaaaaaaaaaaaaaaaaaaaaaaaaaaaaaaaaaaaaaaa",
        "bytes": 10,
        "version": null
      },
      "packages": []
    },
    "requested_language": "zh",
    "chunk_seconds": 600,
    "whisper_cpp_cpu_only": false,
    "sidecar_sha256": "aaaaaaaaaaaaaaaaaaaaaaaaaaaaaaaaaaaaaaaaaaaaaaaaaaaaaaaaaaaaaaaa"
  },
  "chunk_set": null,
  "chunks": {
    "sidecar": {
      "status": "complete",
      "language": "zh",
      "silent": false,
      "chunk_sha256": "aaaaaaaaaaaaaaaaaaaaaaaaaaaaaaaaaaaaaaaaaaaaaaaaaaaaaaaaaaaaaaaa",
      "offset_ms": 0,
      "duration_ms": 2000,
      "raw_output_sha256": null,
      "runtime": null,
      "segments": [
        {
          "start_ms": 100,
          "end_ms": 1000,
          "text": "你好",
          "chunk_index": 0
        }
      ]
    }
  }
}
